experiment_id,stage,research_question,input_condition,main_finding,supported_claim,limitation,safe_manuscript_wording,paper_section
exp-002-arc-length-resampling,Stage 1 trajectory normalization and sampling sensitivity,"Does deterministic arc-length normalization reduce sampling-density dependence in geometry-derived primitives and topology candidates, or introduce new distortion?","Two metric sports trajectories; raw descriptors/primitives/topology compared with arc-length resampling steps 1, 2, 5, 10, and 20 m; stop candidates kept raw-only.","Primitive counts and locations are step-sensitive; resampling exposes sampling dependence and preserves source traceability, but does not establish a production default.","Paper A can say sampling density materially affects descriptor-derived candidate artifacts and that arc-length resampling is useful as an experimental sensitivity probe.","n=2 samples; arbitrary 50 m / 10 s gap guards; linear chord interpolation; no smoothing, perturbation framework, topology persistence test, or production default step.","Arc-length resampling was used as a staged sensitivity analysis; it characterizes sampling-dependent behavior and does not define a canonical preprocessing policy.",Limitations
exp-002b-segmented-resampling,Stage 1 segment-first resampling prototype,"Does segment-first arc-length resampling better respect gap boundaries than global resampling, or introduce segment-boundary distortion?","Two metric sports trajectories; gap split at distance >50 m or dt >10 s; per-segment exact-grid resampling and per-segment descriptors/primitives/topology.","Segment-first processing reduced running topology event counts at 1 m from 3972 to 1574 and preserved no-cross-gap computation, but this may remove real cross-segment structure as well as reduce artifacts.","Paper A can say segment boundaries strongly affect candidate counts and that gap-aware resampling is an experimental design axis.","Gap thresholds uncalibrated; per-segment topology can lose cross-segment relations; n=2; 2 m is not a default; no ground truth decides whether reduced counts are better.","Segment-first resampling demonstrates a stability boundary around gap handling; lower candidate counts are not evidence of more correct detection.",Discussion
exp-003-segment-api-validation,Stage 1 API validation,"Does the experimental segment_resample API produce internally consistent metadata on real samples and step sweeps?","The segment_resample src API was run on skiing_run_01 and running_2026-04-09 at steps 1, 2, 5, 10, and 20 m.","Validation status passed; skiing produced 2 segments and 1 gap, running produced 21 segments and 20 gaps; metadata was internally consistent across tested steps.","Paper A can cite the resampling API as an implemented experimental tool with validated metadata consistency.","This is internal smoke validation only; no geometric truth claim, no sampling policy, and no external validation.","The segment-resample API passed internal metadata consistency checks on two samples, supporting its use as an experimental sensitivity tool only.",Methods
exp-004-sampling-invariance,Stage 1 synthetic sampling-density check,"Can segment_resample produce consistent outputs for sparse and dense observations of the same synthetic geometry?","Synthetic straight line, L-shape, arc, and gap cases; sparse vs dense inputs resampled at 2 m and compared on geometry, descriptors, and turn-boundary proxies.","Straight line, L-shape, and gap cases matched after resampling; the arc case exposed chord-approximation limits with 0.5742 m RMS position difference and 34.0841 degrees cumulative-turn delta.","Paper A can say resampling reduces sampling-density dependence for simple piecewise-linear/gap cases but exposes limits on curved sparse observations.","Synthetic only; turn-boundary proxies are not primitive extractor outputs; no real-sample invariance claim; arc failure shows observed chords limit recoverable geometry.","Sampling-density normalization behaved consistently for simple synthetic structures, while curved sparse observations retained approximation error.",Results
exp-005-smoothing-trial,Stage 2 smoothing and derivative stabilization,"Do deterministic smoothers reduce coordinate jitter artifacts without masking real geometry?","Synthetic straight line, L-shape, and arc with sigma=1.0 m jitter; moving average, Gaussian, and Savitzky-Golay smoothing compared against clean geometry.","All smoothers improved position RMS, but structural metrics remained biased; Gaussian still left cumulative-turn deltas of 286 degrees on straight, 47 degrees on L-shape, and 183 degrees on arc.","Paper A can say smoothing is not transparent to geometry and that unsmoothed/no-silent-smoothing limits must be explicit.","Synthetic sigma=1.0 m trial only; no production smoothing policy from this table alone; smoothing changes structure and does not validate candidate correctness.","Smoothing reduced positional noise in the trial but did not restore clean structural descriptors, so Paper A treats smoothing as a sensitivity issue rather than a solved preprocessing step.",Limitations
exp-006-curvature-robustness,Stage 3 curvature estimator sensitivity,"How much coordinate noise and nonuniform sampling affect the frozen curvature estimator?","Synthetic circle, straight line, and sine wave cases; noise sweep sigma=0.1 to 2.0 m; nonuniform 30 percent decimation comparison.","Noise strongly inflated apparent curvature; at sigma=1.0 m a straight line had RMSE 1.7191 rad/m and bias +1.3559 rad/m; nonuniform decimation increased sine RMSE from 0.0722 to 0.2199 rad/m, far below the sigma=0.5 jitter RMSE 2.7760 rad/m.","Paper A can say the curvature estimator is deterministic and its sensitivity limits are measured on synthetic cases.","Fixed-seed synthetic probe; not a calibrated noise-response curve; estimator sensitivity does not validate true movement curvature.","The curvature estimator is explicit and deterministic, but curvature-derived candidates inherit a measured noise floor under coordinate jitter.",Results
exp-007-primitive-stability,Stage 4 primitive candidate persistence,"How stable are primitive candidate counts and boundaries under coordinate jitter?","Synthetic L-shape, straight, stop, out-and-back, and arc tracks; sigma=0, 0.1, 0.5, and 1.0 m jitter; existing deterministic extractors only.","Candidate counts were sensitive to noise: straight turn candidates appeared at sigma=0.1 m, stop was missed at sigma>=0.5 m, and out-and-back reversal counts rose from 1 clean to 10 at sigma=1.0 m.","Paper A can say primitive outputs are threshold-conditioned candidates and confidence is not perturbation-based.","Synthetic cases only; order-matched boundary shifts are weak when counts differ; thresholds are not calibrated to real GNSS noise.","Primitive candidates persist or fail depending on noise and thresholds; confidence scores remain heuristic and should not be read as survival probabilities.",Limitations
exp-008-topology-robustness,Stage 5 topology tolerance-conditioned behavior,"How do topology candidate counts, intersection locations, and false positives change under tolerance and jitter sweeps?","Synthetic near-miss, figure-8, closed-loop, overlap, and straight-line cases; tolerance sweep and sigma=0.1, 0.5, 1.0 m jitter.","Near-miss detection occurred when tolerance reached the 0.05 m gap; figure-8 proper crossing persisted to sigma=1.0 m with 0.8708 m point shift; endpoint touches and overlaps were fragile; straight jitter produced 2 false positives at sigma=1.0 m.","Paper A can say topology extraction is deterministic but tolerance-conditioned and sensitive to coordinate perturbation.","Synthetic cases only; event counts include paired self_intersection_candidate and loop_candidate representations, not unique crossings; no graph persistence metric.","Topology outputs are tolerance-conditioned candidates; tolerance is an observation parameter, not a ground-truth boundary.",Discussion
